"шевроле нива рулевой наконечник";550000;4;31;538;21;2
"суппорт передний нива шевроле";282000;4;29;369;21;2
"валее 95 вентилятор нива";118000;4;24;22;20;2
"тормозной суппорт шевроле нива";93300;4;30;319;18;2
"амортизаторы hola официальный сайт";10500;4;34;19;18;2
"подшипники раздатки нива";331000;3;24;1950;19;2
"усиленные пружины шевроле нива";88300;4;30;177;18;2
"двухрядный подшипник в раздатку нивы";25000;5;36;617;19;2
"тормозной суппорт нива шевроле";413000;4;30;319;18;2
"шевроле нива стабилизатор поперечной устойчивости";148000;5;49;145;19;2
"комплект рулевых тяг нива шевроле";225000;5;33;95;19;2
"волгаавтопром усиленный ступичный узел";9550;4;38;176;19;2
"рычаг маятниковый нива шевроле";90400;4;30;105;18;2
"сцепление валео цена на гранту";49500;5;30;26;19;2
"1 автомагазин";17400000;2;13;859;19;2
"усиленные пружины нива шевроле";56300;4;30;177;18;2
"шевроле нива усиленные пружины";208000;4;30;175;19;2
"интернет магазин на запчасти шевроле нива";1630000;6;41;635;20;2
"суппорт тормозной шевроле нива";375000;4;30;319;18;2
"рпм нива шевроле";12200;3;16;211;17;2
"амортизаторы hola передние на ваз 2109";101000;6;38;19;17;2
"суппорт на ниву шевроле цена";297000;5;28;265;18;2
"проставки под передние пружины нива шевроле";91800;6;43;74;17;2
"hola амортизаторы официальный сайт";82900;4;34;18;17;2
"балка шевроле нива";176000;3;18;885;17;2
"пружины нива шевроле усиленные";150000;4;30;174;18;2
"ремкомплект шруса карданного вала нива шевроле";106000;6;46;29;18;2
"автомагазин 1";11000000;2;13;860;18;2
"ступичный узел шевроле нива";112000;4;27;605;17;2
"пружины усиленные шевроле нива";179000;4;30;174;18;2
"пружины усиленные нива шевроле";194000;4;30;174;18;2
"рпм шевроле нива";13200;3;16;211;17;2
"крышка передняя раздатки нива";301000;4;29;121;18;2
"пружины шевроле нива усиленные";149000;4;30;174;18;2
"усиленный ступичный узел волгаавтопром";7610;4;38;139;17;2
"запчасти для нивы интернет магазин 2121";875000;6;39;343;15;2
"2123 подшипник дифференциала";101000;3;28;29;15;2
"тяги рулевые 2123";388000;3;17;288;16;2
"кардан белкард на ниву шевроле цена";45200;6;35;31;15;2
"нива 21214 кпп";360000;3;14;862;16;2
"усиленные ступицы шевроле нива";38100;4;30;750;15;2
"редуктор задний шеви нива";224000;4;25;227;17;2
"шевроле нива ступичный узел";116000;4;27;604;16;2
"передний тормозной суппорт шевроле нива";437000;5;39;115;17;2
"защитный кожух переднего тормоза нива шевроле";116000;6;45;16;16;2
"ступица ваз 2121 с двухрядным подшипником";46900;6;41;73;17;2
"ступица на ниву с двухрядным подшипником купить";39200;7;47;88;17;2
"усиленные ступицы нива шевроле";41700;4;30;750;15;2
"белкард карданы на ниву купить";36500;5;30;158;17;2
"стабилизатор поперечной устойчивости шевроле нива";44800;5;49;147;17;2
"бесшумные рычаги раздатки на ниву купить";20000;6;40;130;15;2
"рулевая трапеция нива шеви";156000;4;26;63;14;2
"ремкомплект кпп шевроле нива";347000;4;28;69;15;2
"гбц шевроле нива купить";427000;4;23;182;15;2
"редуктор переднего моста на ниву шевроле";387000;6;40;1142;14;2
"усиленные пружины на ниву шевроле";86700;5;33;177;15;2
"нижний патрубок радиатора гранта";77300;4;32;52;14;2
"нива шевроле усиленные ступицы";163000;4;30;748;15;2
"усиленные пружины на шевроле ниву";87200;5;33;177;15;2
"кардан на ниву белкард купить";32900;5;29;176;15;2
"шеви нива шаровые";44400;3;17;487;15;2
"ваз 2110 головка блока цилиндров";236000;5;32;1788;15;2
"нива шевроле ремкомплект кпп";313000;4;28;69;15;2
"нива усиленный ступичный узел";101000;4;29;561;14;2
"купить кардан на ниву белкард";24600;5;29;176;15;2
"1 авто магазин";5180000000;3;14;1333;15;2
"патрубок нижний радиатора гранта";80300;4;32;52;14;2
"2131 карданный вал задний";112000;4;25;140;14;2
"шевроле нива привод передних колес";3750000;5;34;164;14;2
"ремкомплект кардана шрус нива шевроле";107000;5;37;44;14;2
"купить передние стойки ваз 2110 hola";63800;6;36;14;14;2
"головка блока шевроле нива цена";133000;5;31;197;14;2
"усиленный ступичный узел нива";70700;4;29;557;14;2
"уплотнители дверные калина";90600;3;26;141;14;2
"головка блока нива шевроле цена";175000;5;31;197;14;2
"шевроле нива головка блока цена";765000;5;31;210;14;2
"ваз 2123 передняя подвеска";445000;4;26;121;14;2
"шаровая на шевроле нива";651000;4;23;2649;14;2
"стеклоподъемники задние нива шевроле";458000;4;36;77;14;2
"шевроле нива тормозные барабаны";507000;4;31;625;14;2
"поводки дворников шевроле нива купить";68300;5;37;27;14;2
"патрубок радиатора нижний гранта";95400;4;32;52;14;2
"купить усиленный ступичный узел волгаавтопром";10500;5;45;22;14;2
"ступица усиленная на ниву 21213";94300;5;31;78;13;2
"автоград д";687000;2;10;114;13;2
"шевроле нива блок цилиндров цена";597000;5;32;201;13;2
"ось нижнего рычага 2123 нового образца";25600;6;38;16;13;2
"черниговский кардан на ниву";363;4;27;89;13;2
"передняя крышка раздатки нива";244000;4;29;157;13;2
"калина радиатор печки дааз";91800;4;26;88;13;2
"цена гбц на ниву шевроле";389000;5;24;182;13;2
"замок багажника нива 21214";112000;4;26;44;13;2
"нерегулируемый ступичный узел шевроле нива купить";35800;6;49;26;13;2
"шевроле нива наконечник рулевой тяги";300000;5;36;129;13;2
"крышка раздатки передняя нива";426000;4;29;160;13;2
"серп и молот вал карданный";53800;5;26;156;13;2
"вал карданный 2131";61800;3;18;545;13;2
"термоэлемент на гранту 92 градуса купить";21300;6;40;34;13;2
"шрус кардана нива шевроле ремкомплект";111000;5;37;46;13;2
"ваз 21214 коробка";451000;3;17;651;12;2
"усиленные поворотные кулаки на ниву";71100;5;35;117;12;2
"тяги реактивные на ниву 21214";39500;5;29;212;12;2
"редуктор переднего моста на шевроле ниву купить";375000;7;47;200;12;2
"ваз 2115 пружины передние";484000;4;25;209;12;2
"головка блока цилиндров 2110";480000;4;28;1796;12;2
"усиленные пружины на шевроле нива";185000;5;33;177;12;2
"кардан белкард на ниву шевроле";82300;5;30;103;12;2
"шеви нива гбц";141000;3;13;293;12;2
"кардан белкард на шевроле ниву";82500;5;30;103;12;2
"суппорт на ниву шевроле купить";324000;5;30;198;12;2
"ваз 17 63";13400000;3;9;63;12;2
"кпп ваз 21214 цена";450000;4;18;67;12;2
"тормозные колодки передние ваз 2115";606000;5;35;377;12;2
"нива шевроле колодки передние артикул";133000;5;37;27;12;2
"магазин 1 авто";5390000000;3;14;1346;12;2
"нива шевроле ступицы усиленные на";152000;5;33;657;11;2
"ремкомплект кулисы 1118";46400;3;23;16;11;2
"усиленный ступичный узел нива шевроле цена";108000;6;42;73;12;2
"руль нива шевроле бертоне";97100;4;25;52;11;2
"калина ремкомплект кулисы";101000;3;25;67;12;2
"кулисы 1118 ремкомплект";70200;3;23;16;11;2
"шланг подогрева дроссельной заслонки ваз 2110";60900;6;45;29;12;2
"рулевые тяги усиленные на ниву шевроле";147000;6;38;48;12;2
"цилиндров блок нива шевроле";1330000;4;27;880;12;2
"2121 промвал";34000;2;12;416;12;2
"усиленные ступицы на ниву 2121 с нерегулируемыми подшипниками";33100;8;61;45;12;2
"надфарники нива нового образца";97100;4;30;82;12;2
"рулевая рейка гранта цена с электроусилителем";94200;6;45;90;11;2
"ограничитель двери гранта";25900;3;25;387;12;2
"2123 вакуумный усилитель тормозов";92900;4;33;47;12;2
"руль бертоне нива шевроле";92900;4;25;50;11;2
"нива шевроле трапеция дворников";151000;4;31;51;11;2
"пружины ваз 2115 передние";688000;4;25;194;11;2
"пружины на шевроле нива усиленные";184000;5;33;177;11;2
"проставки под задние пружины нива шевроле";65800;6;41;47;11;2
"2110 головка блока цилиндров";543000;4;28;1524;11;2
"ваз 2115 передние тормозные колодки";613000;5;35;382;11;2
"передние колодки тормозные нива шевроле артикул";128000;6;47;12;11;2
"2123 передний мост";408000;3;18;718;11;2
"рулевая сошка шевроле нива";37900;4;26;79;11;2
"карданная передача шевроле нива";211000;4;31;52;11;2
"кпп 21214";441000;2;9;1892;11;2
"стоимость коробки передач на шевроле ниву";851000;6;41;34;11;2
"привод шевроле нива в сборе";13300000;5;27;100;11;2
"автозапчасти для шевроле нива";652000;4;29;716;11;2
"колодки задние нива шевроле артикул";156000;5;35;24;11;2
"сошка рулевая нива шевроле";52900;4;26;79;11;2
"уплотнитель передней двери калина";211000;4;33;106;10;2
"колодки тормозные задние 2123";200000;4;29;69;11;2
"тормозные колодки задние 2123";360000;4;29;70;11;2
"нива шевроле рулевая сошка";99900;4;26;79;11;2
"шевроле нива рпм купить";246000;4;23;44;11;2
"усиленная ступица на ниву 21213";49800;5;31;68;11;2
"кардан на ниву черниговский";79900;4;27;87;11;2
"кпп на ваз 21214 купить";427000;5;23;179;11;2
"купить рпм шевроле нива";257000;4;23;38;11;2
"купить промвал на крестовине на ниву";33600;6;36;34;11;2
"колодки тормозные передние ваз 2115";605000;5;35;381;11;2
"суппорт на шевроле ниву";372000;4;23;1720;11;2
"подшипник ступичный ваз 21214";165000;4;29;195;11;2
"бесшумные рычаги раздатки";33000;3;25;326;11;2
"крышка раздатки с двухрядным подшипником на шевроле ниву купить";34200;9;63;28;11;2
"пружины шевроле нива фобос";103000;4;26;50;10;2
"разрезная шестерня распредвала на ниву шевроле";20100;6;46;10;10;2
"пружины на ниву от нивы шевроле";552000;6;31;4288;10;2
"магазин запчасти нива";3380000;3;21;3639;10;2
"раздаточная коробка ваз 2123";190000;4;28;196;10;2
"самарский электромеханический завод оао";44100;4;39;30;10;2
"нива шевроле передний суппорт цена";401000;5;34;62;10;2
"магазин интернет ваз нива";20400000;4;25;354;10;2
"фобос пружины задние";198000;3;20;899;10;2
"шевроле нива привод правый";460000;4;26;338;10;2
"редуктор переднего моста шеви нива";434000;5;34;132;10;2
"нива запчасти магазин";8120000;3;21;3639;10;2
"нива шевроле кронштейн запаски";82400;4;30;75;10;2
"суппорт передний нива шевроле цена";358000;5;34;69;10;2
"фобос задние пружины";174000;3;20;899;10;2
"пружины фобос нива шевроле";42300;4;26;50;10;2
"нива шевроле стеклоподъемники задние";450000;4;36;75;10;2
"колодки тормозные задние нива шевроле артикул";127000;6;45;11;10;2
"автозапчасти интернет магазин шевроле нива";3350000;5;42;43;10;2
"ваз 2110 реечные стеклоподъемники на";89000;5;36;207;10;2
"автозапчасти нива шевроле интернет магазин";2360000;5;42;43;10;2
"автозапчасти для нивы";6460000;3;21;2130;10;2
"кольцо грязезащитное поворотного кулака 2121";7700;5;44;11;10;2
"суппорта на ниву шевроле цена";293000;5;29;265;10;2
"шевроле нива рулевая сошка";57000;4;26;80;10;2
"задние колодки нива шевроле артикул";140000;5;35;20;10;2
"автозапчасти интернет магазин нива шевроле";2160000;5;42;43;10;2
"задний кардан чернигов на ниву 2121";57300;6;35;10;10;2
"тормозной суппорт нива шевроле купить";475000;5;37;33;10;2
"сайлентблок растяжки";279000;2;20;568;10;2
"купить усиленный ступичный узел на ниву шевроле";55400;7;47;66;10;2
"нива шевроле задний двухрядный подшипник раздатки";12300;6;49;25;10;2
"сошка рулевая шевроле нива";90300;4;26;100;10;2
"купить вентилируемые тормозные диски на ниву шевроле";94800;7;52;20;9;2
"калина сальник коленвала задний";240000;4;31;90;10;2
"стеклоподъемники форвард ваз 2110 отзывы";34600;5;40;15;10;2
"кронштейн запаски нива шевроле";127000;4;30;75;10;2
"нива шевроле реактивные тяги артикул";43200;5;36;35;10;2
"шеви нива редуктор переднего моста";492000;5;34;129;9;2
"ваз 2123 раздаточная коробка";208000;4;28;195;10;2
"усиленный ступичный узел на ниву шевроле купить";58400;7;47;66;10;2
"рулевая шевроле нива";158000;3;20;4240;10;2
"нива шевроле головка блока цена";673000;5;31;178;10;2
"замок дверной нива шевроле";874000;4;26;141;10;2
"ваз 21214 сцепление инжектор";83300;4;28;28;10;2
"бампер передний нива урбан артикул";113000;5;34;11;9;2
"купить ступицы на ниву с подшипниками ивеко";132000;7;43;82;10;2
"шевроле нива пружины усиленные";211000;4;30;150;10;2
"гур на ниву 21214 купить";167000;5;24;99;9;2
"суппорт на шеви ниву цена";63400;5;25;23;9;2
"новая кпп на шевроле нива цена";1180000;6;30;22;9;2
"шаровые на ниву 21214";97300;4;21;399;9;2
"редуктор заднего моста шеви нива";35000;5;32;124;9;2
"суппорт тормозной нива шевроле купить";323000;5;37;45;9;2
"рейка рулевая 1118 с электроусилителем";90300;5;38;33;9;2
"автозапчасти на шевроле ниву интернет магазин";1740000;6;45;55;9;2
"нива шевроле автозапчасти интернет магазин";3160000;5;42;43;9;2
"карданный вал белкард нива шевроле цена";40100;6;39;12;9;2
"колодка 608212";295;2;14;22;9;2
"нива урбан стеклоподъемники";76200;3;27;104;9;2
"ваз 2115 пружины";576000;3;16;1694;9;2
"редуктор заднего моста нива шеви";462000;5;32;124;9;2
"шаровые опоры на гранту";184000;4;23;916;9;2
"608212 колодка";294;2;14;22;9;2
"рулевая рейка с электроусилителем 1118";54400;5;38;33;9;2
"редуктор задний нива шеви";274000;4;25;177;9;2
"ваз 2121 система отопления";277000;4;26;47;9;2
"шкив коленвала шевроле нива с кондиционером";106000;6;43;28;9;2
"стеклоподъемники нива урбан";82900;3;27;99;9;2
"подшипник раздатки";2700000;2;18;5397;9;2
"ваз 2107 головка блока инжектор";163000;5;31;187;9;2
"автозапчасти нива лада 4х4";433000;4;26;13;9;2
"рулевая рейка 1118 с электроусилителем";93900;5;38;33;9;2
"ступичный узел нива усиленный";76100;4;29;502;9;2
"инжектор ваз 2107 головка блока";156000;5;31;187;9;2
"кронштейн нива переднего моста";395000;4;30;85;9;2
"диск сцепления цена на гранту";329000;5;29;55;9;2
"нива шевроле ступицы усиленные";114000;4;30;589;9;2
"уплотнитель лобового стекла нива урбан";42600;5;38;21;9;2
"интернет магазин автозапчасти нива шевроле";250000;5;42;42;9;2
"система отопления ваз 2121";149000;4;26;47;9;2
"нива промвал сонда";1780;3;18;109;8;2
"купить привода на ниву шевроле";98100;5;30;283;8;2
"запчасти для нивы 21214 интернет магазин";327000;6;40;335;9;2
"нива шевроле коробка цена";7750000;4;25;619;8;2
"купить новую кпп нива шевроле";2330000;5;29;29;8;2
"привод нива шевроле левый";558000;4;25;171;8;2
"купить суппорт тормозной шевроле нива";319000;5;37;42;9;2
"пик автозапчасти";663000;2;16;45;8;2
"пружины фобос нива";33000;3;18;112;9;2
"купить пружины фобос на ваз";93400;5;27;74;8;2
"скоба суппорта шевроле нива";169000;4;27;60;9;2
"купить тормозной суппорт нива шевроле";515000;5;37;42;9;2
"привод левый шевроле нива";565000;4;25;171;8;2
"пыльник шруса карданного вала";1940000;4;29;197;9;2
"дифференциал переднего моста шевроле нива цена";250000;6;46;9;9;2
"усиленный ступичный узел волгаавтопром нива шевроле";38000;6;51;32;8;2
"отопитель 21214 нива";163000;3;20;606;8;2
"замок багажника гранта с электроприводом купить";128000;6;47;32;8;2
"ремкомплект рулевого механизма шевроле нива";708000;5;43;14;8;2
"промвал сонда нива";2570;3;18;42;8;2
"нива шевроле рулевой вал";630000;4;24;63;8;2
"купить печку нового образца на ниву";290000;6;35;21;8;2
"головка блока нива шевроле";170000;4;26;994;8;2
"ремкомплект рулевого механизма нива шевроле";728000;5;43;14;8;2
"кардан на шевроле ниву белкард";45600;5;30;82;8;2
"нива 2131 вал карданный";109000;4;23;182;8;2
"нива шеви редуктор заднего моста";449000;5;32;89;8;2
"пружины фобос купить на ваз";148000;5;27;72;8;2
"промвал нива сонда";2370;3;18;42;8;2
"нива крышка раздатки";275000;3;20;739;8;2
"суппорт для нивы шевроле цена";306000;5;29;265;8;2
"купить печку на ниву нового образца";369000;6;35;22;8;2
"автозапчасти пик";664000;2;16;48;8;2
"эур приора каталожный номер";15700;4;27;29;8;2
"lrh 0111";64400;2;8;21;8;2
"барабаны нива шевроле";729000;3;21;917;8;2
"2131 нива кардан";115000;3;16;605;8;2
"колодки задние нива 21214";149000;4;25;161;8;2
"подшипник выжимной 2181";14000;3;23;147;8;2
"дверной уплотнитель шевроле нива";145000;4;32;64;8;2
"подшипники раздатки 2123";144000;3;24;116;8;2
"задние проставки под пружины нива шевроле";167000;6;41;33;8;2
"рейка рулевая 2192 ваз";124000;4;22;40;8;2
"ступичный узел на ниву и ниву шевроле с подшипником ивеко";95000;10;57;53;8;2
"белкардан на ниву";95700;3;17;54;8;2
"дверной уплотнитель нива шевроле";161000;4;32;64;8;2
"шевроле нива автомагазин";226000;3;24;189;8;2
"ступичный узел на ниву усиленный";69700;5;32;461;8;2
"нива шевроле оригинальные запчасти";1260000;4;34;47;8;2
"каталожный номер рулевой рейки калина";37200;5;37;33;8;2
"шевроле нива передняя усиленная ступица";114000;5;39;96;8;2
"замки дверные на ваз 2110";269000;5;25;345;8;2
"ваз 2107 инжектор высоковольтные провода цена";49100;6;45;27;8;2
"шевроле нива проставки под задние пружины";180000;6;41;33;8;2
"сцепление 2190 гранта";212000;3;21;290;8;2
"шевроле нива подшипники раздатка";285000;4;32;619;8;2
"белкард карданные валы на ниву шевроле";49300;6;38;33;8;2
"нива шевроле автомагазин";309000;3;24;172;8;2
"вал карданный белкард нива";72200;4;26;151;8;2
"калина ремкомплект кпп";347000;3;22;79;8;2
"рулевой вал шевроле нива";699000;4;24;63;8;2
"замок багажника с электроприводом гранта купить";123000;6;47;28;8;2
"муфта кпп калина";231000;3;16;17;8;2
"купить карданный вал белкард на ниву";28300;6;36;30;8;2
"диски тормозные вентилируемые на ниву";68700;5;37;142;7;2
"ваз 2115 тормозные колодки передние";463000;5;35;412;7;2
"крышка раздатки задняя нива 2121";103000;5;32;10;7;2
"ступица нива урбан";161000;3;18;118;7;2
"передний кардан 2123";164000;3;20;64;7;2
"тормозные вентилируемые диски на ниву";82300;5;37;142;7;2
"купить передние пружины на ниву шевроле";697000;6;39;82;7;2
"модернизированный отопитель для нивы";85700;4;36;101;7;2
"купить запчасти для ваз 21213 на официальном сайте ваз";92500;9;54;7;7;2
"купить рпм нива шевроле";288000;4;23;37;7;2
"крышка рк нива";139000;3;14;113;8;2
"niva chevrolet передний мост";992000;4;28;39;7;2
"тормозные диски на ниву вентилируемые";73900;5;37;142;7;2
"правый привод шевроле нива цена";744000;5;31;21;7;2
"нива шевроле тормозные барабаны";716000;4;31;679;8;2
"купить подшипники раздатки нива";300000;4;31;226;7;2
"тяги реактивные усиленные нива";64900;4;30;239;7;2
"шевроле нива шаровая опора артикул";80600;5;34;22;7;2
"ремкомплект шрус кардана шевроле нива";114000;5;37;17;7;2
"усиленные пружины задние шевроле нива";148000;5;37;19;7;2
