"Ключевое слово";"Результатов в Google";"Слов";"Символов";"Частотность Весь мир";"""!Частотность !Весь !мир""";"Позиция в выдаче Google"
"подфарники на ниву нового образца с дхо купить";9580;8;46;101;91;1
"тормозные колодки передние 2123";320000;4;31;100;43;1
"колодки передние тормозные 2123";291000;4;31;108;46;1
"гбц нива шевроле";165000;3;16;1521;50;1
"колодки тормозные передние 2123";392000;4;31;108;46;1
"термостат на 92 градуса на гранту";35300;6;33;355;48;1
"подшипник ступицы нива шевроле нового образца";64600;6;45;54;44;1
"термостат на гранту 92 градуса";25300;5;30;350;71;1
"купить бесшумные рычаги раздатки нива";22100;5;37;171;49;1
"термостат лада гранта на 92 градуса купить";34100;7;42;66;54;1
"бесшумные рычаги раздатки нива купить";21400;5;37;202;46;1
"суппорт нива шевроле";84;3;20;1788;74;1
"термостат 92 градуса на гранту";71;5;30;350;71;1
"передние тормозные колодки 2123";365000;4;31;105;46;1
"шевроле нива головка блока цилиндров цена";286000;6;41;146;52;1
"модернизированная печка на ниву 21214 купить";35400;6;44;96;78;1
"провода высоковольтные ваз 2107 инжектор";47600;5;40;280;42;1
"термостат 92 градуса гранта";30500;4;27;340;26;1
"пружины шевроле нива передние";907000;4;29;917;32;1
"балка передняя нива шевроле";565000;4;27;379;35;1
"передняя балка нива шевроле";95200;4;27;390;32;1
"нива шевроле передняя балка";416000;4;27;390;32;1
"вентилируемые диски на ниву шевроле ниву";82400;6;40;104;26;1
"шевроле нива стеклоподъемник";74100;3;28;1603;35;1
"шевроле нива передняя балка";114000;4;27;373;33;1
"стеклоподъемник шевроле нива";79900;3;28;1603;35;1
"нива шевроле передние пружины";154000;4;29;917;32;1
"тихие рычаги на раздатку 4х4 ваз нива купить";10500;8;44;68;38;1
"стеклоподъемник нива шевроле";66900;3;28;1603;35;1
"нива шевроле балка передняя";434000;4;27;390;32;1
"балка передняя шевроле нива";536000;4;27;379;35;1
"тихие ручки раздатки на ниву купить";19500;6;35;70;39;1
"термостат гранта 92 градуса";9200;4;27;340;26;1
"2115 пружины";831000;2;12;1918;21;1
"фобос 50 пружины";128000;3;16;292;22;1
"гур на ниву комплект";541000;4;20;163;24;1
"уплотнитель проема двери калина";62600;4;31;73;22;1
"2121 раздатки подшипник";135000;3;23;240;23;1
"тормозной суппорт передний шевроле нива";571000;5;39;132;21;1
"ступицы с нерегулируемыми подшипниками нива шевроле купить";39100;7;58;64;25;1
"какие шаровые поставить на шевроле ниву";453000;6;39;34;23;1
"диодные подфарники нива";24400;3;23;202;24;1
"купить карданы белкард на ниву";36300;5;30;176;22;1
"купить бесшумные рычаги раздатки на ниву";20800;6;40;173;25;1
"цилиндр сцепления главный нива урбан";69000;5;36;45;25;1
"подфарники на ниву нового образца с дхо";12800;7;39;150;21;1
"усиленный ступичный узел 2101 с двухрядным нерегулируемым подшипником";28400;8;69;49;24;1
"главный цилиндр сцепления нива урбан";77100;5;36;47;25;1
"цилиндр сцепления главный нива 21214";105000;5;36;86;21;1
"подшипник раздатки 2121";138000;3;23;229;18;1
"шевроле нива балка";910000;3;18;977;19;1
"нерегулируемая ступица с подшипником ивеко на ниву";51800;7;50;61;19;1
"нива кпп 21214";316000;3;14;673;19;1
"болты развальные ваз 2110";24400;4;25;80;19;1
"17 63 главная пара";18800000;4;18;43;19;1
"подшипник skf vkba 3551 на ниву";27300;6;31;22;20;1
"нива модернизированная купить";212000;3;29;252;19;1
"крышка задняя раздатки с двухрядным подшипником";22100;6;47;83;20;1
"валео сцепление на гранту цена";73700;5;30;26;19;1
"стабилизатор шевроле нива";73700;3;25;957;21;1
"запчасти на ниву урбан";385000;4;22;250;20;1
"коробка раздаточная нива 21213";119000;4;30;267;19;1
"крышка раздатки с двухрядным подшипником задняя";17900;6;47;78;20;1
"суппорт тормозной передний шевроле нива";341000;5;39;132;21;1
"2121 подшипник раздатки";148000;3;23;229;18;1
"стабилизатор поперечной устойчивости нива шевроле";44600;5;49;147;17;1
"шевроле нива салазки";26500;3;20;352;17;1
"нива шевроле головка блока цилиндров";344000;5;36;730;18;1
"черниговский кардан на ниву купить";393;5;34;41;17;1
"шевроле нива суппорт тормозной передний";296000;5;39;125;18;1
"термостат на гранту 92 градуса цена";32200;6;35;24;17;1
"главный цилиндр сцепления нива 21214";129000;5;36;69;18;1
"кардан белкард";80500;2;14;667;18;1
"прокладка гбц нива шевроле металлическая";63700;5;40;40;18;1
"нива шевроле передний тормозной суппорт";618000;5;39;120;17;1
"головка блока цилиндров шевроле нива";96100;5;36;723;18;1
"антивибрационные рычаги раздатки на ниву";5030;5;40;58;18;1
"купить бесшумный замок двери на приору от производителя";31900;8;55;17;17;1
"белкард кардан";78300;2;14;667;18;1
"головка блока цилиндров нива шевроле";88000;5;36;723;18;1
"пружины на ниву шевроле усиленные цена";163000;6;38;31;16;1
"усиленные пружины на шевроле ниву цена";116000;6;38;25;15;1
"купить термоэлемент на гранту 92 градуса";24200;6;40;64;15;1
"нива урбан запчасти";202000;3;19;254;16;1
"цена пружины усиленные на шевроле ниву";153000;6;38;29;15;1
"запчасти нива урбан";200000;3;19;254;16;1
"пружины усиленные на ниву шевроле цена";122000;6;38;30;15;1
"шевроле нива гбц купить";416000;4;23;194;16;1
"нива запчасти урбан";528000;3;19;263;16;1
"фланец кардана 2121";70700;3;19;49;16;1
"нива урбан передний бампер каталожный номер";51200;6;43;15;15;1
"шеви нива пружины";157000;3;17;1154;16;1
"цилиндр сцепления ваз 21214 главный";139000;5;35;69;16;1
"термостат 2190 behr";9980;3;19;143;15;1
"подфарник нива 21214 с дхо";43600;5;26;57;16;1
"калина уплотнитель проема двери";65000;4;31;60;16;1
"усиленные пружины на ниву шевроле цена";138000;6;38;25;15;1
"передний бампер нива урбан каталожный номер";50100;6;43;14;14;1
"бампер передний нива урбан каталожный номер";85900;6;43;15;15;1
"ступица нерегулируемая 2123 с подшипником iveco для нивы шевроле";31300;9;64;19;15;1
"наконечник рулевой 2114";386000;3;23;1897;15;1
"шевроле нива поводки дворников";69000;4;30;159;15;1
"нива урбан запчасти купить";469000;4;26;42;14;1
"купить кардан белкард на ниву";28700;5;29;176;15;1
"сцепление валео на гранту цена";64200;5;30;27;15;1
"нива шевроле стабилизатор поперечной устойчивости";128000;5;49;142;15;1
"колодки тормозные 2123 передние";355000;4;31;79;15;1
"кардан белкард на ниву купить";26900;5;29;176;15;1
"гбц нива шевроле купить";190000;4;23;182;15;1
"нива урбан купить запчасти";746000;4;26;42;14;1
"кардан белкард цена на ниву шевроле";21900;6;35;33;15;1
"бесшумные ручки раздатки нива купить";15800;5;36;60;15;1
"рычаги раздатки нива антивибрационные";17100;4;37;76;14;1
"шевроле нива ремкомплект шруса карданного вала";107000;6;46;18;13;1
"усиленный поворотный кулак шевроле нива";95200;5;39;33;13;1
"купить поводки дворников шевроле нива";85000;5;37;26;14;1
"стеклоподъемник шевроле нива передний левый";269000;5;43;41;13;1
"двухрядные подшипники для раздатки нива 2121";21000;6;44;14;14;1
"2123 раздаточная коробка";206000;3;24;394;13;1
"поводки дворников нива шевроле купить";62900;5;37;27;14;1
"купить гбц на ниву шевроле";316000;5;26;207;14;1
"купить черниговский кардан на ниву";360;5;34;38;14;1
"стеклоподъемник нива шевроле передний левый";218000;5;43;41;13;1
"купить головку блока цилиндров нива шевроле";319000;6;43;125;14;1
"пружины на ниву шевроле усиленные";142000;5;33;177;14;1
"2123 вал карданный промежуточный";98300;4;32;94;13;1
"какой редуктор заднего моста стоит на ниве шевроле";378000;8;50;24;14;1
"запчасти нива урбан купить";683000;4;26;40;14;1
"кардан черниговский на ниву";84800;4;27;88;13;1
"первичный вал кпп нива шевроле";122000;5;30;158;12;1
"шрус на ниву 21214";131000;4;18;700;12;1
"поводки дворников нива шевроле";8770;4;30;146;13;1
"купить салазки сидений для нива шевроле";42900;6;39;59;12;1
"нива шевроле стеклоподъемник передний левый";245000;5;43;40;12;1
"первичный вал кпп шевроле нива";114000;5;30;158;12;1
"задняя крышка раздатки с двухрядным подшипником";20700;6;47;124;13;1
"поводки дворников шевроле нива";9230;4;30;146;13;1
"цилиндр сцепления главный 21214 valeo";31400;5;37;25;13;1
"нерегулируемые ступицы ивеко на ниву шевроле";85000;6;44;33;12;1
"нива шевроле поводки дворников";91000;4;30;146;13;1
"тяги реактивные урбан";58100;3;21;168;13;1
"усиленные пружины на нива шевроле";187000;5;33;177;12;1
"купить термостат на гранту на 92 градуса";34600;7;40;101;13;1
"кардан задний на ниву 2121 чернигов";28900;6;35;14;13;1
"купить гбц для нивы шевроле";311000;5;27;207;12;1
"кронштейн катколлектора ваз 2110";49800;4;32;12;12;1
"редуктор заднего моста 2123";247000;4;27;222;12;1
"гбц для нивы шевроле купить";333000;5;27;194;12;1
"кронштейн генератора лада калина с винтовым натяжителем купить";31800;8;62;12;12;1
"распорная планка задних колодок ваз 2108";48700;6;40;21;12;1
"система отопления ваз 2113";273000;4;26;19;12;1
"передний стеклоподъемник нива шевроле левый";235000;5;43;40;12;1
"1118 ремкомплект кулисы";49000;3;23;21;12;1
"электростеклоподъемник шевроле нива";326000;3;35;181;12;1
"реактивные тяги нива урбан купить";48600;5;33;27;12;1
"тяги реактивные нива урбан купить";29100;5;33;27;12;1
"электростеклоподъемник нива шевроле";8890;3;35;181;12;1
"купить реактивные тяги нива урбан";20900;5;33;25;12;1
"подфарники с дхо на ниву";28600;5;24;344;12;1
"лада спорт опора";2040000;3;16;146;12;1
"купить подфарники на ниву 21214 с дхо";89000;7;37;20;12;1
"передняя балка шевроле нива купить";483000;5;34;62;11;1
"болты развальные приора";21600;3;23;90;11;1
"стеклоподъемник передний левый нива шевроле";244000;5;43;40;12;1
"ручки дверей нива урбан";188000;4;23;44;11;1
"шевроле нива бертоне руль";99800;4;25;52;11;1
"передняя балка нива шевроле купить";398000;5;34;62;11;1
"купить кронштейн генератора лада калина с винтовым натяжителем";96400;8;62;12;12;1
"стеклоподъемник передний левый шевроле нива";244000;5;43;27;11;1
"кзатэ 140а купить";34400;3;17;57;12;1
"купить привод передний на шевроле ниву";1770000;6;38;115;11;1
"ремкомплект кулисы калина";68200;3;25;67;12;1
"кардан нива шевроле серп и молот";43500;6;32;67;12;1
"нива шевроле салазки передних сидений";41100;5;37;98;11;1
"ступица 2123 нового образца";58400;4;27;45;12;1
"привод передний шевроле нива";3260000;4;28;1041;12;1
"диодные подфарники на ниву 21214";113000;5;32;25;11;1
"шевроле нива привод в сборе";7080000;5;27;105;11;1
"кардан на ниву 21213 белкард купить";36400;6;35;23;11;1
"привод в сборе шевроле нива";569000;5;27;100;11;1
"купить усиленные пружины на ниву шевроле";128000;6;40;42;11;1
"усиленные пружины на ниву шевроле купить";151000;6;40;42;11;1
"усиленные ступицы на шеви ниву 2123 с нерегулируемыми подшипниками";84500;9;66;12;11;1
"пружины фобос 40 приора";39300;4;23;11;11;1
"купить запчасти нива урбан";662000;4;26;43;11;1
"ваз 2123 передние тормозные колодки";350000;5;35;40;11;1
"салазки передних сидений шевроле нива";90100;5;37;98;11;1
"карданная передача нива шевроле";69300;4;31;52;11;1
"проставки под задние пружины шевроле нива";67500;6;41;47;11;1
"шевроле нива пыльник кулисы";142000;4;27;48;11;1
"привод в сборе нива шевроле";6610000;5;27;100;11;1
"пыльник вала карданного 2123";122000;4;28;33;11;1
"нива шевроле гбц купить";379000;4;23;136;11;1
"привода на шевроле ниву";3150000;4;23;4029;10;1
"шрус 21214 нива";179000;3;15;626;10;1
"поводок стеклоочистителя нива шевроле";66400;4;37;43;10;1
"прокладка коллектора впускного приора";170000;4;37;97;10;1
"прокладка впускного коллектора приора";91000;4;37;97;10;1
"пружины нива шевроле фобос";54800;4;26;50;10;1
"балка передняя шевроле нива купить";716000;5;34;62;11;1
"поводок стеклоочистителя шевроле нива";63000;4;37;43;10;1
"салазки передних сидений нива шевроле";41300;5;37;98;11;1
"приора прокладка впускного коллектора";178000;4;37;97;10;1
"пыльник карданного вала 2123";106000;4;28;33;11;1
"передача карданная нива шевроле";241000;4;31;33;11;1
"2123 ступица нового образца";77200;4;27;43;10;1
"тросик багажника нива 2131";64200;4;26;25;10;1
"ваз 2113 система отопления";205000;4;26;18;11;1
"калина ограничители дверей";219000;3;26;401;10;1
"главный цилиндр сцепления ваз 21214";92900;5;35;95;10;1
"купить термостат на гранту 92 градуса";32000;6;37;112;10;1
"поворотный кулак нива шевроле усиленный";63700;5;39;62;10;1
"цилиндр сцепления главный ваз 21214";155000;5;35;106;10;1
"суппорт тормозной передний на 2123";180000;5;34;27;10;1
"чугунные барабаны на ниву шевроле";75300;5;33;25;10;1
"передний стабилизатор поперечной устойчивости нива шевроле";85600;6;58;48;10;1
"поворотный кулак усиленный нива шевроле";102000;5;39;62;10;1
"стабилизатор поперечной устойчивости нива шевроле передний";138000;6;58;48;10;1
"усиленный поворотный кулак нива шевроле";99300;5;39;66;10;1
"подшипник ступицы ваз 2123 нового образца";54700;6;41;16;10;1
"нива шевроле привод в сборе";5600000;5;27;104;10;1
"купить салазки для сидений шевроле нива";38100;6;39;66;10;1
"ваз 2123 тормозные колодки передние";473000;5;35;43;10;1
"купить головку блока цилиндров на шевроле ниву";318000;7;46;113;10;1
"солина зеркала на ниву";62200;4;22;34;10;1
"нива шевроле усиленные пружины";147000;4;30;157;10;1
"тормозные вентилируемые тормозные диски на ниву шевроле";90000;7;55;76;10;1
"купить кардан белкард нива";37800;4;26;184;10;1
"коробка раздаточная ваз 2123";207000;4;28;195;10;1
"главный тормозной цилиндр ваз 21214 нового образца";46100;7;50;16;10;1
"стеклоподъемники ваз 2110 форвард";60800;4;33;78;10;1
"термостат на гранту 92 градуса купить";47400;6;37;104;10;1
"колодки тормозные передние ваз 2123";321000;5;35;40;10;1
"нива шевроле суппорта";332000;3;21;1840;10;1
"нива шевроле салазки сидений";89100;4;28;190;10;1
"купить термостат на гранту 92 градуса цена";33600;7;42;11;10;1
"термостат 92 градуса на гранту купить";23400;6;37;104;10;1
"ваз 2123 коробка раздаточная";227000;4;28;195;10;1
"нива урбан ручки дверей";160000;4;23;48;10;1
"ваз 21214 главный цилиндр сцепления";140000;5;35;95;10;1
"нива шевроле пружины усиленные";164000;4;30;157;10;1
"передние пружины на ниву шевроле";93100;5;32;924;9;1
"верхний патрубок радиатора приора";71100;4;33;68;9;1
"вентилируемые диски на ниву шевроле купить";53900;6;42;24;9;1
"подшипник ступицы передней нива урбан";70300;5;37;23;9;1
"крышка рк нива с двухрядным подшипником";24100;6;39;61;9;1
"стеклоподъемники форвард отзывы ваз 2110";32700;5;40;12;9;1
"раздатка на ниву с двухрядными подшипниками купить";25700;7;50;115;9;1
"нива шевроле стеклоподъемник цена";554000;4;33;50;9;1
"гбц на ниву шевроле купить";330000;5;26;194;9;1
"балка задняя 1118";88700;3;17;56;9;1
"доводчики ограничители дверей лада гранта";17300;5;41;39;9;1
"кулаки с подшипниками ивеко на ниву";69300;6;35;322;9;1
"ваз 21214 шрус";182000;3;14;393;9;1
"цилиндр сцепления главный 21214";166000;4;31;238;9;1
"передний бампер нива урбан артикул";52800;5;34;11;9;1
"передние пружины на шевроле ниву";642000;5;32;924;9;1
"вентилируемые тормозные диски на ниву шевроле купить";53700;7;52;20;9;1
"вал первичный нива шевроле";152000;4;26;380;9;1
"главная пара 17 63";7350000;4;18;34;9;1
"гидрокомпенсаторы на ваз 2123 нового образца";18300;6;44;52;9;1
"2190 шаровая опора";165000;3;18;66;9;1
"шаровые на гранту";310000;3;17;2126;9;1
"салазки для сидений нива шевроле купить";68600;6;39;65;9;1
"главный цилиндр сцепления 21214";172000;4;31;231;9;1
"салазки для сидений шевроле нива купить";43100;6;39;65;9;1
"2190 опора шаровая";178000;3;18;66;9;1
"передние пружины на нива шевроле";625000;5;32;924;9;1
"салазки передних сидений шевроле нива купить";43300;6;44;19;9;1
"антивибрационные ручки раздатки на ниву ваз 2121";5730;7;48;9;9;1
"поворотный кулак нива шевроле с 2 рядным подшипником ивеко";84200;9;58;52;9;1
"передние пружины на шевроле нива";835000;5;32;924;9;1
"купить головку на шевроле ниву";393000;5;30;179;9;1
"фобос пружины 40";173000;3;16;79;9;1
"суппорта нива шевроле";337000;3;21;1788;9;1
"опора кпп 2123 задняя";373000;4;21;29;9;1
"купить кардан на ниву 21213 белкард";53100;6;35;28;9;1
"крышка раздатки с двухрядным подшипником на шеви ниву";33300;8;53;19;9;1
"40 фобос пружины";142000;3;16;79;9;1
"шрус нива 21214";107000;3;15;702;9;1
"тормозной суппорт купить шевроле нива";801000;5;37;41;9;1
"подшипник передней ступицы нива урбан";107000;5;37;23;9;1
"нива пружины фобос";49200;3;18;112;9;1
"задняя опора кпп 2123";272000;4;21;28;9;1
"шрус ваз 21214";142000;3;14;427;9;1
"купить кардан белкард на ниву 21213";27000;6;35;28;9;1
"цена термостат на гранту 92 градуса";19700;6;35;25;9;1
"автозапчасти для шевроле нивы";4090000;4;29;716;9;1
"каталожный номер шаровая опора шевроле нива";52200;6;43;9;9;1
"пружины на ниву шевроле передние";503000;5;32;929;8;1
"нива 21213 колодки задние";179000;4;25;116;8;1
"задние амортизаторы гранта цена";1170000;4;31;77;8;1
"пружины на шевроле ниву передние";485000;5;32;875;8;1
"купить привода на шевроле ниву";2950000;5;30;283;8;1
"пружины передние на ниву шевроле";710000;5;32;929;8;1
"ограничители дверей гранта";42500;3;26;387;8;1
"привод левый нива шевроле";579000;4;25;171;8;1
"нерегулируемый подшипник ступицы нива 21214";83300;5;43;54;8;1
"нива 21214 шрус";143000;3;15;661;8;1
"нива лада 4х4 автозапчасти";828000;4;26;13;9;1
"ваз 2109 заливная горловина";92500;4;27;117;8;1
"головка блока шевроле нива";142000;4;26;994;8;1
"крышка переднего редуктора нива шевроле";265000;5;39;57;8;1
"термостат бехр на гранту";64700;4;24;68;9;1
"нексия стеклоподъемники форвард";32300;3;31;63;8;1
"амортизатор 21214 2915004";21900;3;25;22;8;1
"шевроле нива салазки сидений";92100;4;28;258;8;1
"ступица переднего колеса шевроле нива с нерегулируемыми подшипниками";32400;8;68;15;8;1
"бесшумные ручки раздатки на ниву купить";31000;6;39;30;8;1
