"нива 21214 промежуточный вал цена";63700;5;33;54;27;4
"редуктор на шевроле ниву цена";497000;5;29;821;27;4
"тяги рулевые на ниву шевроле";343000;5;28;1131;27;4
"комплект рулевых тяг нива шевроле цена";276000;6;38;40;26;4
"ваз 2110 бесшумные замки цена";72100;5;29;68;25;4
"главная пара кпп 21083";96000;4;22;31;25;4
"пружины нива шевроле цена";270000;4;25;384;26;4
"редуктор на ниву шевроле задний цена";683000;6;36;284;25;4
"пружины передние на калину";923000;4;26;1001;26;4
"подшипник передней ступицы ваз 21214";143000;5;36;233;25;4
"вакуумный усилитель тормозов шевроле нива цена";59400;6;46;36;26;4
"пружины на ниву шевроле";122000;4;23;4262;26;4
"вакуумный усилитель нива шевроле";93400;4;32;299;26;4
"нива урбан бампер передний";172000;4;26;280;25;4
"вакуумный усилитель тормозов нива шевроле цена";60700;6;46;36;26;4
"fobos каталог";126000;2;13;102;26;4
"привод нива шевроле передний";2970000;4;28;1075;25;4
"вакуумный усилитель шевроле нива";77800;4;32;299;26;4
"купить запчасти нива шеви";1030000;4;25;193;26;4
"редуктор переднего моста 2123";238000;4;29;227;25;4
"шевроле нива редуктор передний купить";495000;5;37;332;23;4
"промежуточный вал 21213";103000;3;23;897;24;4
"нива шевроле пружины передние цена";645000;5;34;111;24;4
"купить запчасти на ниву 21214 в интернет магазине";351000;8;49;27;24;4
"передние пружины шевроле нива цена";631000;5;34;111;24;4
"шевроле нива передний редуктор купить";983000;5;37;332;23;4
"гбц инжектор ваз 2107 купить";144000;5;28;60;24;4
"передние пружины нива шевроле цена";146000;5;34;111;24;4
"купить гбц ваз 2107 инжектор";168000;5;28;66;24;4
"шаровая опора 2123";113000;3;18;361;24;4
"рычаг стеклоочистителя калина";303000;3;29;192;24;4
"ваз 2107 инжектор купить гбц";115000;5;28;60;24;4
"крепление заднего амортизатора шевроле нива";482000;5;43;107;24;4
"калина рычаг стеклоочистителя";366000;3;29;192;24;4
"колодки нива шевроле";350000;3;20;3519;25;4
"лифт комплект нива 2121 купить";79800;5;30;183;23;4
"пружины шевроле нива передние цена";669000;5;34;106;23;4
"купить редуктор нива шевроле передний";1200000;5;37;332;23;4
"стеклоподъемник левый передний ваз 2110";232000;5;39;132;23;4
"купить редуктор передний нива шевроле";519000;5;37;332;23;4
"модернизированная печка для нивы купить";39900;5;39;184;23;4
"для шеви нива запчасти";1600000;4;22;1078;23;4
"шевроле нива передний суппорт";326000;4;29;371;23;4
"стеклоподъемник ваз 2110 левый передний";255000;5;39;132;23;4
"ваз 21214 цилиндр сцепления рабочий";92900;5;35;98;23;4
"колодки нива задние";2130000;3;19;2170;23;4
"ваз 2121 задний мост";283000;4;20;987;23;4
"шевроле нива шрус купить";463000;4;24;613;23;4
"нерегулируемые ступицы на ниву шевроле волгаавтопром отзывы";30500;7;59;28;23;4
"стеклоподъемник ваз 2110 передний левый";445000;5;39;132;23;4
"нива колодки задние";1890000;3;19;2170;23;4
"вентилируемые тормоза на ниву";89200;4;29;142;23;4
"шрус вала карданного нива шевроле";168000;5;33;508;21;4
"нива шевроле тормозной суппорт";336000;4;30;323;21;4
"ремкомплект суппорта нива шевроле";78200;4;33;111;22;4
"главный цилиндр сцепления нива";282000;4;30;1142;21;4
"нива главный цилиндр сцепления";256000;4;30;1135;22;4
"тяги реактивные ваз 2123";82600;4;24;132;21;4
"нива 21213 промвал цена";39800;4;23;92;22;4
"головка двигателя ваз 2110 цена 8 клапанов";478000;7;42;25;22;4
"нива шевроле купить шрус";509000;4;24;644;22;4
"нива шевроле передний суппорт";342000;4;29;378;21;4
"ограничитель двери калина";47800;3;25;337;22;4
"фобос пружины 50";127000;3;16;292;22;4
"бесшумные ручки раздатки нива";10100;4;29;185;21;4
"редуктор передний шевроле нива купить";525000;5;37;340;22;4
"кардан серп и молот";86400;4;19;301;23;4
"коробка передач на шевроле ниву";1690000;5;31;3202;21;4
"цилиндр сцепления нива главный";735000;4;30;1124;20;4
"передний суппорт нива шевроле";335000;4;29;378;21;4
"кронштейн приемной трубы 2108";111000;4;29;51;21;4
"ваз 2131 задний кардан";81800;4;22;110;20;4
"передний суппорт шевроле нива";370000;4;29;378;21;4
"запчасти к нива шевроле";1680000;4;23;8208;20;4
"шевроле нива пружины задние цена";785000;5;32;65;21;4
"интернет магазин запчасти для шевроле нивы";1250000;6;42;647;21;4
"дифференциал ваз 2108";127000;3;21;437;21;4
"нива 21214 ступица";163000;3;18;635;21;4
"пружины fobos каталог";118000;3;21;29;21;4
"купить стеклоподъемники на ваз 2110 реечные";92100;6;43;34;21;4
"нива колодки передние";1780000;3;21;2168;20;4
"передний мост нива шевроле цена купить в сборе";664000;8;46;36;21;4
"запчасти на ниву шевроле цена";5050000;5;29;623;21;4
"термостат лузар 92 градуса";12300;4;26;50;20;4
"блок монтажный шеви нива";153000;4;24;72;20;4
"привод передних колес шевроле нива купить";2880000;6;41;31;20;4
"электростеклоподъемники форвард купить";24600;3;38;141;20;4
"мост передний нива шеви";201000;4;23;764;20;4
"купить промежуточный вал на ниву";70000;5;32;199;20;4
"пружины на шевроле нива купить";1930000;5;30;610;20;4
"кронштейн генератора 21214";96700;3;26;244;20;4
"ваз 2110 стеклоподъемники купить";612000;4;32;530;20;4
"тормоз задний правый в сборе ваз 2115";232000;7;37;20;20;4
"лада гранта замок багажника с электроприводом купить";121000;7;52;26;20;4
"петля двери 2110";304000;3;16;470;20;4
"пружины на нива шевроле";319000;4;23;4262;20;4
"пружины на нива шевроле купить";2240000;5;30;610;20;4
"2110 петля двери";319000;3;16;470;20;4
"передние стойки на гранту цена";701000;5;30;412;20;4
"сколько стоит рулевая рейка с электроусилителем на калину цена";55000;9;62;24;20;4
"пружины ваз 2115 задние цена";535000;5;28;71;19;4
"решетка радиатора урбан";250000;3;23;644;19;4
"купить задние пружины на ваз 2111 усиленные";70200;7;43;33;19;4
"проставки под пружины нива шевроле купить";166000;6;41;64;19;4
"головка на ваз 2110 цена 8 клапанов";475000;7;35;291;19;4
"нива шевроле подшипник раздатки";232000;4;31;620;19;4
"ваз 21214 главный тормозной цилиндр";171000;5;35;139;19;4
"стойки задние гранта цена";2610000;4;25;112;19;4
"нива урбан ограничитель двери";40100;4;29;39;19;4
"тормозные колодки лада спорт";233000;4;28;206;19;4
"самара сэмз";46300;2;11;100;19;4
"сызрань пластик ооо";421000;3;19;55;19;4
"стеклоподъемник на ваз 2110";825000;4;27;6995;19;4
"лада спорт тормозные колодки";1570000;4;28;212;19;4
"сэмз самара";45200;2;11;100;19;4
"трапеция нива шевроле";61600;3;21;862;19;4
"задние пружины шевроле нива цена";155000;5;32;66;18;4
"нива шевроле маятниковый рычаг";57200;4;30;105;18;4
"повторитель поворота 2190";69400;3;25;28;18;4
"стеклоподъемники на ваз 2110";634000;4;28;6995;18;4
"цилиндр тормозной главный 2123";319000;4;30;103;18;4
"замок багажника гранта с электроприводом";122000;5;40;155;18;4
"передний бампер урбан нива";163000;4;26;250;19;4
"ось петли двери калина";124000;4;22;81;18;4
"купить проставки под пружины нива шевроле";203000;6;41;58;19;4
"сколько стоит рулевая рейка на калину с электроусилителем цена";70000;9;62;23;18;4
"автозапчасти нива лада";801000;3;22;64;19;4
"нива шевроле стабилизатор";660000;3;25;909;19;4
"ремкомплект раздатки нива";103000;3;25;120;18;4
"ваз 2123 кпп купить";672000;4;19;139;18;4
"купить пружины на шевроле нива";1260000;5;30;596;19;4
"задние пружины нива шевроле цена";796000;5;32;66;18;4
"пружины на ваз 2111 задние усиленные";104000;6;36;97;18;4
"запчасти нива шеви купить";1470000;4;25;168;18;4
"пружины задние усиленные ваз 2111";141000;5;33;110;18;4
"нерегулируемые ступицы на ниву цена";56600;5;35;268;18;4
"нива шевроле промежуточный вал цена";171000;5;35;78;18;4
"подшипник ступицы ивеко на ниву";139000;5;31;784;18;4
"трос ручника 2190";72500;3;17;37;18;4
"суппорт на шевроле ниву цена";270000;5;28;265;18;4
"задний редуктор шеви нива";299000;4;25;227;18;4
"вал ваз 21213 промежуточный вал";101000;5;31;218;18;4
"карданный вал 2131 задний";139000;4;25;150;18;4
"автозапчасти нива 4х4 интернет магазин";464000;5;38;20;18;4
"шаровые на шевроле ниву купить";367000;5;30;198;18;4
"подогрев сидений купить на ниву 21214";85200;6;37;24;18;4
"стеклоподъемник 2110";746000;2;20;7630;18;4
"крепление амортизатора заднего нива";422000;4;35;304;17;4
"нива 21214 печка";138000;3;16;1569;17;4
"купить решетка радиатора на ниву урбан";73900;6;38;159;17;4
"пружины задние нива шевроле цена";807000;5;32;66;17;4
"тихие ручки раздатки на ниву";18700;5;28;137;17;4
"стойки на гранту купить";91100;4;23;962;17;4
"сколько стоит стеклоподъемник на ваз 2110";674000;6;41;76;17;4
"стеклоподъемники форвард ваз 2107";35300;4;33;224;17;4
"поворотный кулак на ниву с подшипником ивеко";55300;7;44;213;17;4
"пружины задние нива шевроле купить";786000;5;34;92;17;4
"подогрев сидений на ниву 21214 купить";83700;6;37;22;17;4
"ступицы усиленные на ниву";193000;4;25;1302;17;4
"пружины задние шевроле нива цена";181000;5;32;66;17;4
"шевроле нива задние пружины цена";820000;5;32;64;17;4
"пружины шевроле нива задние цена";1060000;5;32;66;17;4
"рулевые наконечники на ваз 2114";361000;5;31;1860;17;4
"задние пружины на ваз 2111 усиленные";88000;6;36;108;17;4
"печка нива 21214";37800;3;16;1569;17;4
"балка задняя калина цена";127000;4;24;168;17;4
"стеклоподъемники реечные на ваз 2110 купить";98000;6;43;30;17;4
"2123 кардан";223000;2;11;664;17;4
"ваз 2121 промежуточный вал";138000;4;26;279;17;4
"передние тормозные колодки ваз 2110 артикул";169000;6;43;20;17;4
"редуктор задний 2121 нива";433000;4;25;349;17;4
"цена редуктор передний нива шевроле цена";470000;6;40;341;17;4
"подшипники переднего моста 2123";269000;4;31;108;17;4
"ступичный узел на ниву с подшипником ивеко купить";35500;8;49;64;17;4
"нива печка 21214";144000;3;16;1569;17;4
"рычаг нижний нива шевроле";292000;4;25;479;17;4
"редуктор шеви нива задний";245000;4;25;227;17;4
"вал промежуточный ваз 2121";171000;4;26;279;17;4
"нива шевроле рпм";228000;3;16;211;17;4
"ваз 2131 задний карданный вал";117000;5;29;81;17;4
"шеви нива рулевой наконечник";183000;4;28;97;16;4
"калина кпп корпус";643000;3;17;123;16;4
"амортизатор ваз 2123 задний";423000;4;27;139;16;4
"коробка передач на шевроле нива";375000;5;31;3202;16;4
"металлическая прокладка гбц нива шевроле";54500;5;40;33;16;4
"цена рулевой наконечник нива шевроле";430000;5;36;89;16;4
"замок ваз 2110 дверной";701000;4;22;364;16;4
"ваз 2110 гбц";621000;3;12;3458;16;4
"пластик ооо сызрань";632000;3;19;32;16;4
"купить задние пружины нива шевроле";865000;5;34;87;16;4
"рулевая рейка 11183 3400010";82500;4;27;81;16;4
"замок дверной ваз 2110";72900;4;22;364;16;4
"шевроле нива пружины передние купить";602000;5;36;80;16;4
"усиленная ступица 2123";83700;3;22;324;16;4
"рулевой наконечник шеви нива";152000;4;28;101;16;4
"ваз 2110 дверной замок";116000;4;22;364;16;4
"шевроле нива рулевой наконечник цена";472000;5;36;87;16;4
"суппорт нива шеви";114000;3;17;253;16;4
"нива шевроле пружины задние купить";756000;5;34;88;16;4
"нива 2121 лифт комплект";56800;4;23;488;16;4
"лифт комплект нива 2121";52800;4;23;488;16;4
"дверные уплотнители калина";82800;3;26;140;16;4
"купить пружины задние шевроле нива";765000;5;34;87;16;4
"нива шевроле задние пружины цена";803000;5;32;64;16;4
"задние пружины шевроле нива купить";820000;5;34;85;16;4
"лифт комплект 2121 нива";85500;4;23;488;16;4
"кпп корпус калина";630000;3;17;123;16;4
"пружины на шевроле нива цена";1780000;5;28;360;16;4
"подфарники на ниву нового образца";7850;5;33;359;16;4
"лада калина уплотнитель двери";60400;4;29;395;16;4
"фиксатор замка двери ваз 2109";110000;5;29;31;16;4
"цена на передний мост на ниву шевроле";848000;7;37;493;16;4
"передние шрусы шевроле нива цена";449000;5;32;47;15;4
"магазин запчастей нива шевроле";286000;4;30;1066;15;4
"дверной замок ваз 2110";70900;4;22;364;16;4
"шевроле нива вал карданный задний";376000;5;33;277;15;4
"передний мост на шевроле ниву цена";657000;6;34;490;15;4
"колодки ваз 2115 передние";506000;4;25;608;15;4
"купить передний мост на ниву шевроле цена";624000;7;41;75;16;4
"фиксатор передачи ваз 2110";141000;4;26;152;15;4
"сколько стоит редуктор на шевроле ниву";775000;6;38;78;16;4
"кулак поворотный нива под нерегулируемый подшипник";22100;6;50;36;15;4
"купить передний мост на шевроле ниву цена";866000;7;41;75;16;4
"наконечник рулевой шеви нива";173000;4;28;101;16;4
"уплотнитель двери лада калина";68300;4;29;392;15;4
"суппорт шеви нива";26100;3;17;253;16;4
"nivapechka";453000;1;10;39;16;4
"полуось заднего моста нива";368000;4;26;1013;15;4
"усиленные ступицы на шевроле ниву";114000;5;33;757;15;4
"рычаги нива";417000;2;11;10625;15;4
"ваз 21214 промежуточный вал";95500;4;27;64;15;4
"нива рычаг нижний";605000;3;17;1775;15;4
"купить задние пружины шевроле нива";892000;5;34;87;15;4
"уплотнители дверей лада калина купить";226000;5;37;82;15;4
"подшипники раздатки нива шевроле";36100;4;32;620;15;4
"вал промежуточный ваз 21214";93600;4;27;64;15;4
"нива шевроле подшипники раздатки";228000;4;32;620;15;4
"механизм натяжения ремня генератора калина";90600;5;42;61;15;4
"усиленные ступицы на ниву шевроле отзывы";93400;6;40;50;15;4
"вал карданный промежуточный нива шевроле";126000;5;40;108;15;4
"гур насос 2123";256000;3;14;156;15;4
"калина механизм натяжения ремня генератора";57300;5;42;61;15;4
"бампер передний нива урбан купить";137000;5;33;104;15;4
"пружины шеви на ниву";48700;4;20;1177;15;4
"прокладка коллектора впускного 2112";164000;4;35;195;14;4
"нива шевроле внутренняя граната цена";99300;5;36;32;14;4
"опора пружины передней подвески";8570000;4;31;106;14;4
"нива шевроле шаровые";444000;3;20;2645;14;4
"запчасти для ваз 21214 нива интернет магазин";295000;7;44;26;14;4
"трапеция 2123 стеклоочистителя";106000;3;30;38;14;4
"автомагазин нива 4х4";110000;3;20;43;15;4
"пружины нива шеви цена";263000;4;22;59;14;4
"нива 4х4 автомагазин";79400;3;20;43;15;4
"помпа на ваз 21214 инжектор цена";61900;6;32;18;14;4
"вакуумный усилитель тормозов ваз 21214 цена";66000;6;43;16;15;4
"домкрат нива отзывы";239000;3;19;21;15;4
"прокладка коллектора 2112 впускного";163000;4;35;195;14;4
"ремонт кулисы нива шевроле";131000;4;26;58;14;4
"шаровая на гранту цена";212000;4;22;223;15;4
"уплотнитель задней двери шевроле нива";89000;5;37;82;14;4
"рулевые тяги шевроле нива купить";455000;5;32;103;14;4
"ремкомплект трапеции стеклоочистителя калина купить";21100;5;51;40;14;4
"шаровая на нива шевроле";554000;4;23;2649;14;4
"калина ремкомплект трапеции дворников";204000;4;37;58;14;4
"шрус на ниву 21214 цена";153000;5;23;133;14;4
"ваз 2107 инжектор гбц цена";135000;5;26;55;14;4
"нива шевроле шаровые опоры цена";114000;5;31;229;14;4
"шаровые нива шевроле";122000;3;20;2657;14;4
"шевроле нива магазин запчастей";4710000;4;30;1086;14;4
"ремни безопасности ваз 21213 нива";146000;5;33;34;14;4
"новая печка на ниву 21214";126000;5;25;143;14;4
"вал карданный 2123";124000;3;18;532;14;4
"вакуумный усилитель тормозов нива шевроле";69300;5;41;142;14;4
"шевроле нива ремонт кулисы";152000;4;26;50;14;4
"уплотнитель задней двери нива шевроле";231000;5;37;82;14;4
"рулевая трапеция на ниву шевроле";130000;5;32;600;14;4
"лада гранта задние амортизаторы";866000;4;31;292;14;4
"коробка передач на ниву 21214 цена";215000;6;34;84;14;4
"коробка раздаточная ваз 21214";134000;4;29;193;14;4
"форвард реечные стеклоподъемники";19200;3;32;110;14;4
"стеклоподъемники реечные форвард";12300;3;32;110;14;4
"бесшумные ручки раздатки на ниву";13500;5;32;165;14;4
"пружины для шевроле нивы купить";895000;5;31;488;14;4
"стеклоподъемники форвард реечные";14000;3;32;110;14;4
"купить шаровые опоры шевроле нива";399000;5;33;121;14;4
"карданный вал 2123";105000;3;18;532;14;4
"балка задняя на калину цена";434000;5;27;154;14;4
"ваз 2112 шаровая цена";151000;4;21;172;14;4
"цена гбц на ваз 2107 инжектор";128000;6;29;56;14;4
"стеклоподъемники ваз 2110 купить";293000;4;32;412;14;4
"головка блока цилиндров 1118";274000;4;28;87;14;4
"авто запчасти авто нива";16300000;4;23;433;14;4
"нива шевроле блок цилиндров";978000;4;27;984;13;4
"диски вентилируемые на ниву";84900;4;27;226;13;4
"шеви нива блок монтажный";157000;4;24;53;13;4
"нива урбан бампер передний купить";147000;5;33;90;13;4
"лада калина уплотнитель дверей";227000;4;30;395;13;4
"пружины задние на ваз 2111 усиленные";90600;6;36;84;13;4
"вал карданный ваз 21214";201000;4;23;242;13;4
"трапеция стеклоочистителя 2123";105000;3;30;20;13;4
"вентилируемые диски на ниву";81800;4;27;226;13;4
"2123 цилиндр тормозной передний";262000;4;31;77;13;4
"полуось 2123 ваз";201000;3;16;161;13;4
"промвал цена нива";55200;3;17;304;13;4
"доводчики дверей лада гранта";86600;4;28;158;13;4
"цена передний редуктор шеви нива";1050000;5;32;32;13;4
"рулевая рейка с электроусилителем гранта купить";94500;6;47;22;14;4
"лада калина балка задняя";438000;4;24;219;13;4
"решетка радиатора нива урбан артикул";49700;5;36;15;13;4
"радиатор печки дааз калина";71900;4;26;87;13;4
"2114 шаровые";583000;2;12;2936;13;4
"пружины задние на ваз 2111 усиленные купить";80400;7;43;21;13;4
"передние пружины шевроле нива купить";678000;5;36;75;13;4
"подфарники на ниву лед купить";91300;5;29;26;13;4
"пружины для нива шевроле";1650000;4;24;4262;13;4
"передние пружины нива шевроле купить";811000;5;36;75;13;4
"задний бампер нива урбан цена";159000;5;29;26;13;4
"2123 гцс";26400;2;8;38;13;4
"стеклоподъемники реечные ваз 2110";52200;4;33;175;13;4
"задний редуктор шевроле нива купить";1370000;5;35;176;13;4
"пружина шевроле нива задняя";615000;4;27;663;13;4
"задние пружины ваз 2111 усиленные";41300;5;33;106;13;4
"стеклоподъемники ваз 2110 реечные";50500;4;33;175;13;4
"уплотнитель двери лада калина купить";271000;5;36;82;13;4
"лада 4х4 интернет магазин запчасти";672000;5;34;71;13;4
"гур приора шланг";584000;3;16;375;13;4
"ооо сызрань пластик";155000;3;19;40;13;4
"бампер урбан на обычную ниву";45700;5;28;112;13;4
"купить запчасти для нивы шевроле";209000;5;32;1323;13;4
"купить уплотнитель двери лада калина";203000;5;36;80;13;4
"карданный вал 2131";71600;3;18;545;13;4
"передняя стойка гранта цена";1560000;4;27;430;13;4
"пружины передние шевроле нива купить";760000;5;36;91;13;4
"реактивные тяги урбан";60900;3;21;177;13;4
